"","id","age","gender","training_condition","outcome","money_won","time_elapsed","strategy","know_ug","ug_strategy"
"165","id0172",33,"female","Proposer",5,0.25,377888,"accept if at least 3 dollars","Question not asked","Question not asked"
"166","id0173",40,"male","Proposer",5,0.25,315197,"I only felt one offer was a slap in the face and it was keep 9, I get 1. They are overly greedy so we both get zero.","Question not asked","Question not asked"
"167","id0174",51,"female","None",3,0.15,397934,"accepting meant at least 1 dollar, so I always accepted, i don't think it affected the offers and was more than zero.","Question not asked","Question not asked"
"168","id0175",51,"male","Proposer",0,0,328911,"Usually <$5 I didn't accept","Question not asked","Question not asked"
"169","id0176",27,"Male","Proposer",2,0.1,324610,"I accepted everything so that I can get guaranteed bonus","Question not asked","Question not asked"
"170","id0177",52,"Female","Proposer",5,0.25,422751,"Yes, Any 6 and 4 or 5 and 5 I accepted, Any amount outside of those were rejected.","Question not asked","Question not asked"
"171","id0178",35,"female","None",6,0.3,288183,"I was going to accept all of them so i had the chance to get something","Question not asked","Question not asked"
"172","id0179",64,"female","None",0,0,596607,"if the difference was more than 60 40 I rejected it. Also, since I inevitably lose and it seems the round gives me ZERO no matter what, I felt at ease rejecting lowball offers, because if you HAD chosen one, even if I said yes to every single scenario, I KNOW I would have ""won"" the round the awarded me only $1. That's how these things work. I never win bonuses. Ever.  I think they are mythical.","Question not asked","Question not asked"
"173","id0180",33,"male","Proposer",3,0.15,280646,"i saw no reason not to accept any","Question not asked","Question not asked"
"174","id0181",27,"male","None",5,0.25,345740,"I believe we can both earn either way","Question not asked","Question not asked"
"175","id0182",27,"female","Proposer",0,0,290682,"I did not want to take an offer that offered me lower than the other participant/ AI","Question not asked","Question not asked"
"176","id0183",19,"male","Proposer",0,0,313007,"I just tried to accept most of them in hope of receiving money. ","Question not asked","Question not asked"
"177","id0184",31,"male","None",2,0.1,318234,"i accepted every offer because i want a bonus for certain","Question not asked","Question not asked"
"178","id0186",28,"Male","Proposer",6,0.3,464955,"I rejected offers that I felt were unfairly balanced, especially from the AI since it is learning based off of my answers. ","Question not asked","Question not asked"
"179","id0187",25,"Female","Proposer",4,0.2,608820,"If it was a close split, i accepted ","Question not asked","Question not asked"
"180","id0188",20,"Male","Proposer",5,0.25,364903,"I chose where I most broke even, or I gained alot more money.","Question not asked","Question not asked"
"181","id0189",62,"female","None",0,0,409186,"anything above 3 dollars i would usually take","Question not asked","Question not asked"
"182","id0190",75,"female","None",2,0.1,474650,"no","Question not asked","Question not asked"
"183","id0191",57,"male","None",5,0.25,330073,"If I was getting $4 or more, I accepted the offer.","Question not asked","Question not asked"
"184","id0192",31,"male","Proposer",6,0.3,555124,"Yes","Question not asked","Question not asked"
"185","id0193",35,"female","None",0,0,362445,"Yes, I would not accept anything less than $4 for me","Question not asked","Question not asked"
"186","id0194",52,"female","Proposer",0,0,498398,"if the amounts were more fair. ","Question not asked","Question not asked"
"187","id0195",44,"Female","Proposer",6,0.3,387340,"I wanted a fair share.","Question not asked","Question not asked"
"188","id0196",31,"female","Proposer",4,0.2,332493,"I was hoping to earn at least 4$","Question not asked","Question not asked"
"189","id0197",22,"female","Proposer",4,0.2,317552,"i have none","Question not asked","Question not asked"
"190","id0198",29,"Male","Proposer",6,0.3,647974,"I was accepting all offers at first, but then I decided to only accept offers above $3 because I started wanting more, I wanted it to be more fair.","Question not asked","Question not asked"
"191","id0199",21,"male","None",0,0,292752,"No strategy","Question not asked","Question not asked"
"192","id0200",29,"Trans Man","None",6,0.3,317016,"Accept any offer higher than $4 (had a few misclicks)","Question not asked","Question not asked"
"193","id0201",44,"female","Proposer",1,0.05,630921,"I accepted offers for myself that were $2 and up.","Question not asked","Question not asked"
"194","id0202",76,"male","None",0,0,471945,"rejecting offers less than 30%","Question not asked","Question not asked"
"195","id0203",29,"Female","Proposer",0,0,275354,"No","Question not asked","Question not asked"
"196","id0204",69,"female","Proposer",0,0,482858,"I rejected all the AI offers because AIs don't need money. I figured that meant I wouldn't get anything either but that was okay, I never expect bonuses from studies.","Question not asked","Question not asked"
"197","id0205",29,"cis male","Proposer",5,0.25,284683,"I needed to make 40% or more.","Question not asked","Question not asked"
"198","id0206",20,"female","Proposer",4,0.2,371100,"i accepted most of them to ensure id get a bonus since i knew either way we'd both benefit","Question not asked","Question not asked"
"199","id0207",25,"Male","None",0,0,370302,"Tried to accept the offers that start at $4, anything below most likely would be rejected","Question not asked","Question not asked"
"200","id0208",25,"agender","None",0,0,349988,"at first i was like well even the amounnt i'd rather get something instead of nothing but then halfway through changed my mind to if it seems unfair i'm going to reject out of spite.","Question not asked","Question not asked"
"201","id0209",66,"female","None",6,0.3,397187,"My strategy was to accept every offer, since I saw no benefit to rejecting any.","Question not asked","Question not asked"
"202","id0210",27,"female","Proposer",0,0,335778,"If I received less than the other person, I rejected it.","Question not asked","Question not asked"
"203","id0211",46,"m","None",4,0.2,330882,"no","Question not asked","Question not asked"
"204","id0212",28,"female","None",0,0,305586,"with the prolific participants if it was mostly fair I accepted and with AI I accepted if it was fair or in my favor","Question not asked","Question not asked"
"205","id0213",30,"Male","None",6,0.3,272428,"I accepted all offers as there was no upside for not accepting an offer.","Question not asked","Question not asked"
"206","id0214",29,"female","Proposer",0,0,396386,"the same if it was a real person vs ai","Question not asked","Question not asked"
"207","id0215",20,"Male","Proposer",4,0.2,316711,"I tried to accept only offers that were fair to both of us, within a dollar.","Question not asked","Question not asked"
"208","id0216",26,"26","Proposer",5,0.25,334118,"I accepted all offers because I would rather have even one dollar versus none.","Question not asked","Question not asked"
"209","id0217",27,"Transgender Man","None",1,0.05,490136,"I decided prior to the task to accept any offers presented to me, unless I encountered an attention check question that would require me to reject an offer. I figure it is better to walk away with some bonus than no bonus, so even if the payout would be uneven, I'm happy to earn some additional money regardless of what another person may be earning.","Question not asked","Question not asked"
"210","id0218",40,"male","None",5,0.25,302852,"none","Question not asked","Question not asked"
"211","id0219",32,"Male","None",0,0,324517,"Generally rejected offers of 1$","Question not asked","Question not asked"
"212","id0220",40,"male","None",0,0,316483,"i looked for fair offers","Question not asked","Question not asked"
"213","id0221",42,"male","Proposer",3,0.15,397681,"The lowest I would accept is $3. Anything under that was too low so I would reject it.","Question not asked","Question not asked"
"214","id0222",32,"Male","None",6,0.3,327797,"I think it's best to accept most of the offers.","Question not asked","Question not asked"
"215","id0224",37,"male","None",5,0.25,465673,"i got the most or equal","Question not asked","Question not asked"
"216","id0225",37,"Male","None",0,0,712182,"NONE","Question not asked","Question not asked"
"217","id0226",59,"Female","None",6,0.3,303294,"I would accept anything offered and be grateful. :)","Question not asked","Question not asked"
